{
  "$schema": "./overview.schema.json",
  "version": 1,
  "title": "Your runtime foundation for Physical AI.",
  "summary": "Run perception, learned policies, and control on a shared SoC—with execution policy, data movement, recording, and diagnosis in the platform beneath them.",
  "workloads": [
    "Perception",
    "Learned policies",
    "Planning & control",
    "Robotics workloads"
  ],
  "platforms": [
    "NVIDIA Jetson / DRIVE",
    "Orin / Thor",
    "Other SoCs"
  ],
  "capabilities": [
    {
      "id": "resources",
      "title": "Resource policy",
      "category": "Resources",
      "summary": "Make placement, budgets, and resource accounting explicit.",
      "status": "building-blocks",
      "limits": "CPU building blocks are available; GPU execution policy remains roadmap scope.",
      "components": [
        "crates/resource-policy",
        "crates/cgroup-bpf",
        "crates/task-accounting",
        "crates/monitor-core",
        "apps/system-monitor"
      ],
      "integrations": [
        "linux"
      ],
      "evidence": [
        "libs/resources/README.md"
      ]
    },
    {
      "id": "memory",
      "title": "Memory & IPC",
      "category": "Memory",
      "summary": "Coordinate shared buffers, ownership, and CPU/GPU completion across processes.",
      "status": "building-blocks",
      "limits": "Existing shared-memory integrations require platform-specific qualification.",
      "components": [
        "crates/cuda-host-memory",
        "crates/cuda-dora-shm",
        "apps/cuda-shm-demo"
      ],
      "integrations": [
        "dora",
        "linux",
        "cuda"
      ],
      "evidence": [
        "libs/memory/README.md"
      ]
    },
    {
      "id": "observability",
      "title": "Observability",
      "category": "Observability",
      "summary": "Connect runtime activities to output ancestry and measured latency.",
      "status": "building-blocks",
      "limits": "Capture and retention bounds are defined by each component.",
      "components": [
        "crates/activity-tracing",
        "crates/step-provenance",
        "crates/telemetry-protocol",
        "apps/activity-demo",
        "apps/provenance-demo",
        "apps/cpu-viewer"
      ],
      "integrations": [
        "otel"
      ],
      "evidence": [
        "libs/activity-tracing/README.md",
        "libs/step-provenance/README.md"
      ]
    },
    {
      "id": "recording",
      "title": "Recording",
      "category": "Storage",
      "summary": "Preserve timestamped data and runtime evidence with bounded buffering and explicit loss reporting.",
      "status": "building-blocks",
      "limits": "Durability and supported capture paths follow the selected recorder's contract.",
      "components": [
        "crates/storage-persistence",
        "crates/telemetry-mcap",
        "apps/storage-demo",
        "apps/mcap-recorder"
      ],
      "integrations": [
        "mcap",
        "linux"
      ],
      "evidence": [
        "libs/storage-persistence/README.md",
        "libs/telemetry/mcap/README.md"
      ]
    },
    {
      "id": "faults",
      "title": "Fault handling",
      "category": "Faults",
      "summary": "Collect reports, aggregate health and freshness, and supervise liveness.",
      "status": "building-blocks",
      "limits": "Application policy owns the response. Broader lifecycle integration remains roadmap scope.",
      "components": [
        "crates/fault-reporter",
        "crates/fault-aggregation",
        "crates/fault-protocol",
        "apps/fault-watchdog",
        "apps/fault-demo"
      ],
      "integrations": [
        "dora"
      ],
      "evidence": [
        "libs/fault/README.md",
        "apps/fault-watchdog/README.md"
      ]
    },
    {
      "id": "configuration",
      "title": "Configuration",
      "category": "Configuration",
      "summary": "Compose typed configuration and retain provenance and deployment fingerprints.",
      "status": "building-blocks",
      "limits": "Configuration composition is available; a unified platform lifecycle is future work.",
      "components": [
        "crates/pbtxt-config"
      ],
      "integrations": [],
      "evidence": [
        "libs/pbtxt-config/README.md"
      ]
    },
    {
      "id": "orchestration",
      "title": "Workflow execution",
      "category": "Runtime",
      "summary": "Run observable Rust steps, supervise Compose workloads and collect filesystem changes before cleanup.",
      "status": "building-blocks",
      "limits": "Docker Compose execution and local Linux directory-bind overlays are implemented. Other lifecycle backends and hardware qualification remain roadmap work.",
      "components": [
        "apps/orchestrator-demo",
        "crates/orchestrator",
        "crates/workload-docker",
        "crates/workload-lifecycle"
      ],
      "integrations": [
        "linux"
      ],
      "evidence": [
        "libs/orchestrator/README.md",
        "libs/workload-docker/README.md",
        "libs/workload-lifecycle/README.md",
        "apps/orchestrator-demo/README.md"
      ]
    }
  ],
  "integrations": [
    {
      "id": "linux",
      "title": "Linux",
      "group": "execution",
      "summary": "Processes, scheduling, memory, resource accounting and I/O.",
      "url": "https://www.kernel.org/",
      "status": "integrated",
      "components": [
        "crates/resource-policy",
        "crates/cgroup-bpf",
        "crates/storage-persistence",
        "apps/system-monitor"
      ],
      "evidence": [
        "docs/roadmap.md",
        "libs/resources/README.md"
      ]
    },
    {
      "id": "cuda",
      "title": "CUDA",
      "group": "execution",
      "summary": "NVIDIA compute and memory APIs.",
      "url": "https://developer.nvidia.com/cuda-zone",
      "status": "platform-dependent",
      "components": [
        "crates/cuda-host-memory",
        "crates/cuda-dora-shm",
        "apps/cuda-shm-demo"
      ],
      "evidence": [
        "libs/memory/cuda-host-memory/README.md",
        "libs/memory/cuda-dora-shm/README.md"
      ]
    },
    {
      "id": "nvsci-nvmedia",
      "title": "NvSci / NvMedia",
      "group": "execution",
      "summary": "Planned integration.",
      "url": "https://developer.nvidia.com/docs/drive/drive-os/7.0.3/public/drive-os-linux-sdk-api-ref/nvmedia__2d__sci_8h.html",
      "status": "platform-dependent",
      "components": [],
      "evidence": [
        "docs/roadmap.md"
      ]
    },
    {
      "id": "dora",
      "title": "Dora IPC",
      "summary": "Node communication and dataflow.",
      "url": "https://dora-rs.ai/",
      "status": "integrated",
      "components": [
        "crates/cuda-dora-shm",
        "apps/system-monitor",
        "apps/provenance-demo",
        "apps/mcap-recorder"
      ],
      "evidence": [
        "docs/vision.md",
        "libs/memory/cuda-dora-shm/README.md"
      ],
      "group": "communication"
    },
    {
      "id": "mcap",
      "title": "MCAP",
      "summary": "Timestamped messages, schemas and indexes.",
      "url": "https://mcap.dev/",
      "status": "integrated",
      "components": [
        "crates/storage-persistence",
        "crates/telemetry-mcap",
        "apps/mcap-recorder"
      ],
      "evidence": [
        "libs/telemetry/mcap/README.md",
        "libs/storage-persistence/README.md"
      ],
      "group": "communication"
    },
    {
      "id": "otel",
      "title": "OpenTelemetry",
      "summary": "Activity trace export.",
      "url": "https://opentelemetry.io/",
      "status": "optional",
      "components": [
        "crates/activity-tracing"
      ],
      "evidence": [
        "libs/activity-tracing/README.md"
      ],
      "group": "communication"
    }
  ],
  "useCases": [
    {
      "id": "repeat",
      "title": "Run and repeat an experiment",
      "summary": "Run your workloads, inspect the results, and run again. doramcap captures recordings and execution evidence for each run and verifies workload cleanup before the next.",
      "outcome": "Repeat experiments with recording and provenance handled by the workflow.",
      "status": "illustrative",
      "capabilities": [
        "orchestration",
        "resources",
        "recording"
      ],
      "integrations": [
        "linux",
        "mcap"
      ],
      "components": [
        "apps/orchestrator-demo",
        "apps/system-monitor",
        "crates/orchestrator",
        "crates/workload-docker"
      ],
      "evidence": [
        "apps/orchestrator-demo/README.md",
        "libs/workload-docker/docs/102626-compose-workflow.md",
        "libs/workload-docker/docs/102626-filesystem-metadata.md"
      ]
    },
    {
      "id": "perception",
      "title": "Run a perception pipeline",
      "summary": "Move a payload through a dataflow, retain its buffer until processing completes, trace the work, and capture evidence for inspection.",
      "outcome": "Follow data from shared buffers to observable application output.",
      "status": "illustrative",
      "capabilities": [
        "memory",
        "observability",
        "recording",
        "configuration"
      ],
      "integrations": [
        "dora",
        "mcap",
        "linux",
        "cuda"
      ],
      "components": [
        "apps/cuda-shm-demo",
        "apps/provenance-demo",
        "apps/mcap-recorder",
        "crates/cuda-dora-shm",
        "crates/activity-tracing",
        "crates/step-provenance",
        "crates/storage-persistence"
      ],
      "evidence": [
        "apps/cuda-shm-demo/README.md",
        "apps/provenance-demo/README.md",
        "apps/mcap-recorder/README.md"
      ]
    },
    {
      "id": "latency",
      "title": "Explain a missed deadline",
      "summary": "Inspect activity timing and output ancestry, relate a delay to resource accounting, and retain evidence for the next experiment.",